{
  "$schema": "http://json-schema.org/draft-07/schema#",
  "type": "object",
  "properties": {
    "externalUsers": {
      "type": [
        "array"
      ],
      "items": {
        "type": [
          "object"
        ],
        "properties": {
          "externalId": {
            "type": [
              "string"
            ]
          },
          "userId": {
            "type": [
              "string"
            ]
          },
          "teamId": {
            "type": [
              "string"
            ]
          },
          "id": {
            "type": [
              "string"
            ]
          },
          "provider": {
            "type": [
              "string"
            ]
          },
          "externalName": {
            "type": [
              "string"
            ]
          },
          "integrationId": {
            "type": [
              "string"
            ]
          }
        }
      }
    },
    "id": {
      "type": [
        "string"
      ]
    },
    "email": {
      "type": [
        "string"
      ]
    },
    "name": {
      "type": [
        "string"
      ]
    },
    "user": {
      "type": [
        "object"
      ],
      "properties": {
        "identities": {
          "type": [
            "array"
          ],
          "items": {
            "type": [
              "object"
            ],
            "properties": {
              "id": {
                "type": [
                  "string"
                ]
              },
              "name": {
                "type": [
                  "string"
                ]
              },
              "organization": {
                "type": [
                  "object"
                ],
                "properties": {
                  "slug": {
                    "type": [
                      "string"
                    ]
                  },
                  "name": {
                    "type": [
                      "string"
                    ]
                  }
                }
              },
              "provider": {
                "type": [
                  "object"
                ],
                "properties": {
                  "id": {
                    "type": [
                      "string"
                    ]
                  },
                  "name": {
                    "type": [
                      "string"
                    ]
                  }
                }
              },
              "dateVerified": {
                "type": [
                  "string"
                ],
                "format": "date-time"
              },
              "dateSynced": {
                "type": [
                  "string"
                ],
                "format": "date-time"
              }
            }
          }
        },
        "avatar": {
          "type": [
            "object"
          ],
          "properties": {
            "avatarType": {
              "type": [
                "string"
              ]
            },
            "avatarUuid": {
              "type": [
                "string",
                "null"
              ]
            },
            "avatarUrl": {
              "type": [
                "string",
                "null"
              ]
            }
          }
        },
        "authenticators": {
          "type": [
            "array"
          ],
          "items": {}
        },
        "canReset2fa": {
          "type": [
            "boolean"
          ]
        },
        "id": {
          "type": [
            "string"
          ]
        },
        "name": {
          "type": [
            "string"
          ]
        },
        "username": {
          "type": [
            "string"
          ]
        },
        "email": {
          "type": [
            "string"
          ]
        },
        "avatarUrl": {
          "type": [
            "string"
          ]
        },
        "isActive": {
          "type": [
            "boolean"
          ]
        },
        "hasPasswordAuth": {
          "type": [
            "boolean"
          ]
        },
        "isManaged": {
          "type": [
            "boolean"
          ]
        },
        "dateJoined": {
          "type": [
            "string"
          ],
          "format": "date-time"
        },
        "lastLogin": {
          "type": [
            "string",
            "null"
          ],
          "format": "date-time"
        },
        "has2fa": {
          "type": [
            "boolean"
          ]
        },
        "lastActive": {
          "type": [
            "string",
            "null"
          ],
          "format": "date-time"
        },
        "isSuperuser": {
          "type": [
            "boolean"
          ]
        },
        "isStaff": {
          "type": [
            "boolean"
          ]
        },
        "experiments": {
          "type": [
            "object"
          ]
        },
        "emails": {
          "type": [
            "array"
          ],
          "items": {
            "type": [
              "object"
            ],
            "properties": {
              "id": {
                "type": [
                  "string"
                ]
              },
              "email": {
                "type": [
                  "string"
                ]
              },
              "is_verified": {
                "type": [
                  "boolean"
                ]
              }
            }
          }
        }
      }
    },
    "orgRole": {
      "type": [
        "string",
        "null"
      ]
    },
    "role": {
      "type": [
        "string",
        "null"
      ]
    },
    "roleName": {
      "type": [
        "string",
        "null"
      ]
    },
    "projects": {
      "type": [
        "array",
        "null"
      ],
      "items": {
        "type": [
          "string",
          "null"
        ]
      }
    },
    "pending": {
      "type": [
        "boolean"
      ]
    },
    "expired": {
      "type": [
        "boolean"
      ]
    },
    "flags": {
      "type": [
        "object"
      ],
      "properties": {
        "idp:provisioned": {
          "type": [
            "boolean"
          ]
        },
        "idp:role-restricted": {
          "type": [
            "boolean"
          ]
        },
        "sso:linked": {
          "type": [
            "boolean"
          ]
        },
        "sso:invalid": {
          "type": [
            "boolean"
          ]
        },
        "member-limit:restricted": {
          "type": [
            "boolean"
          ]
        },
        "partnership:restricted": {
          "type": [
            "boolean"
          ]
        }
      }
    },
    "dateCreated": {
      "type": [
        "string"
      ],
      "format": "date-time"
    },
    "inviteStatus": {
      "type": [
        "string"
      ]
    },
    "inviterName": {
      "type": [
        "string",
        "null"
      ]
    },
    "text_content": {
      "type": [
        "string",
        "null"
      ],
      "description": "Combined text content for search and embedding"
    }
  },
  "key_properties": ["id"]
}