{"dateCreated": "2018-08-10T17:19:32.112Z", "user": {"username": "user_name", "lastLogin": "2019-01-09T22:46:14.697Z", "isSuperuser": false, "isManaged": false, "lastActive": "2019-01-09T22:46:14.848Z", "isStaff": false, "id": "user_id", "isActive": true, "has2fa": true, "name": "user_name", "avatarUrl": "url", "dateJoined": "2018-09-26T18:51:08.572Z", "emails": [{"is_verified": true, "id": "email_id", "email": "email"}], "avatar": {"avatarUuid": null, "avatarType": "type_avatar"}, "hasPasswordAuth": true, "email": "email"}, "roleName": "role_name", "expired": false, "id": "id", "projects": ["list", "of", "projects"], "name": "name", "role": "role", "flags": {"sso:linked": false, "sso:invalid": false}, "email": "email", "pending": false}